{
  "schema_version": 2,
  "service": "checkout-api",
  "namespace": "payments",
  "lookback_window": "1h",
  "collected_at": "2026-07-06T14:00:00Z",
  "coverage_ratio": 0.95,
  "series": {
    "latency_histogram": {
      "metric_name": "http_request_duration_seconds_bucket",
      "buckets": [
        { "le": 0.005, "count": 50 },
        { "le": 0.01, "count": 200 },
        { "le": 0.025, "count": 800 },
        { "le": 0.05, "count": 2000 },
        { "le": 0.1, "count": 6000 },
        { "le": 0.25, "count": 20000 },
        { "le": 0.5, "count": 50000 },
        { "le": 1.0, "count": 75000 },
        { "le": 2.5, "count": 90000 },
        { "le": 5.0, "count": 97000 },
        { "le": 10.0, "count": 99500 },
        { "le": "+Inf", "count": 100000 }
      ],
      "total_count": 100000,
      "sum": 68000.0
    },
    "request_total": {
      "metric_name": "http_requests_total",
      "total": 100000,
      "rate_samples": [
        { "timestamp": "2026-07-06T13:00:00Z", "value": 3.2 },
        { "timestamp": "2026-07-06T13:05:00Z", "value": 3.4 },
        { "timestamp": "2026-07-06T13:10:00Z", "value": 2.9 },
        { "timestamp": "2026-07-06T13:15:00Z", "value": 3.6 },
        { "timestamp": "2026-07-06T13:20:00Z", "value": 3.3 },
        { "timestamp": "2026-07-06T13:25:00Z", "value": 3.5 },
        { "timestamp": "2026-07-06T13:30:00Z", "value": 3.0 },
        { "timestamp": "2026-07-06T13:35:00Z", "value": 3.4 },
        { "timestamp": "2026-07-06T13:40:00Z", "value": 3.7 },
        { "timestamp": "2026-07-06T13:45:00Z", "value": 3.1 },
        { "timestamp": "2026-07-06T13:50:00Z", "value": 3.8 },
        { "timestamp": "2026-07-06T13:55:00Z", "value": 3.3 }
      ]
    },
    "error_total": {
      "metric_name": "http_requests_errors_total",
      "total": 250
    },
    "saturation": {
      "cpu": {
        "metric_name": "container_cpu_usage_ratio",
        "samples": [0.35, 0.38, 0.42, 0.39, 0.31, 0.70, 0.46, 0.34, 0.37, 0.41]
      },
      "memory": {
        "metric_name": "container_memory_usage_ratio",
        "samples": [0.59, 0.62, 0.64, 0.60, 0.66, 0.77, 0.63, 0.61, 0.65, 0.62]
      },
      "available": true
    },
    "traces": {
      "available": true,
      "source": "tempo",
      "total_spans": 450000,
      "service_spans": 120000,
      "span_latency_p99_ms": 750.0,
      "span_latency_p50_ms": 150.0,
      "top_dependencies": [
        { "service": "payment-gateway", "p99_ms": 640.0, "call_count": 80000, "error_rate": 0.003 },
        { "service": "inventory-db", "p99_ms": 48.0, "call_count": 120000, "error_rate": 0.0 },
        { "service": "auth-service", "p99_ms": 14.0, "call_count": 60000, "error_rate": 0.0005 }
      ],
      "slow_span_pattern": "payment-gateway accounts for 85% of p99 tail latency"
    },
    "logs": {
      "available": true,
      "source": "loki",
      "total_entries": 250000,
      "error_entries": 620,
      "error_breakdown": [
        { "category": "connection_timeout", "count": 370, "ratio": 0.5968 },
        { "category": "validation_error", "count": 155, "ratio": 0.2500 },
        { "category": "auth_failure", "count": 95, "ratio": 0.1532 }
      ],
      "error_rate_by_category": {
        "connection_timeout": 0.00148,
        "validation_error": 0.00062,
        "auth_failure": 0.00038
      }
    }
  },
  "provenance": {
    "prometheus_endpoint": "https://thanos-querier.openshift-monitoring.svc:9091",
    "query_timestamps": {
      "start": "2026-07-06T13:00:00Z",
      "end": "2026-07-06T14:00:00Z"
    },
    "queries": {
      "latency": "histogram_quantile(0.99, sum(rate(http_request_duration_seconds_bucket{service=\"checkout-api\",namespace=\"payments\"}[5m])) by (le))",
      "request_total": "sum(increase(http_requests_total{service=\"checkout-api\",namespace=\"payments\"}[1h]))",
      "error_total": "sum(increase(http_requests_errors_total{service=\"checkout-api\",namespace=\"payments\"}[1h]))",
      "cpu_usage": "avg(container_cpu_usage_ratio{pod=~\"checkout-api.*\",namespace=\"payments\"})",
      "memory_usage": "avg(container_memory_usage_ratio{pod=~\"checkout-api.*\",namespace=\"payments\"})"
    }
  }
}
